الاسم,المدينة,المنطقة,الحي,الشارع,صندوق البريد,الرمز الريدي,الجوال,البريد الالكتروني
منتجع الجوف السياحي,طبرجل,الجوف,بسيطا,شارع طبرجل,0,,014-6268282,m-3811@live.com
فندق دان الفندقية,المدينة المنورة,المدينة المنورة,العريض,غالب بن نجيح,3982,451,+9661483885558,danhotel2020@gmail.com
فرع شركة دانة الكورنيش المحدودة,جدة,مكة المكرمة,حي الشاطيء,الوجيه الصغير,111,,012-2607111,Badr.AbuMazen@rosewoodhotels.com
فندق الانصار جولدن توليب,المدينة المنورة,المدينة المنورة,حي بني خدرة,الملك فهد,2770,691,+966148292001,hrd@ansarhotels.com
شقق قصر سعد السكني للوحدات السكنية,أبها,عسير,حي الربوة,طريق الملك عبدالعزيز,8601,11260,+966172249999,saadpalace@hotmail.com
رسم الضيافة,الطائف,مكة المكرمة,شبرا,ابوبكر,0,,012-7347854,rasm.aldiyafah@gmail.com
شقق سبع منازل للوحدات السكنية,جدة,مكة المكرمة,السلامة,عثمان الراضي,8288,138694,+966126167777,7sevenhomes@gmail.com
مساكن المعمورة للوحدات السكنية المفروشة,الرياض,الرياض,عكاظ,طريق ديراب,1,,011-4214076,Msakn344@gmail.com
الرمال البيضاء,الرايس,المدينة المنورة,الكورنيش,العام الكورنيش,6669,,014-3340430,salmanfatin@hotmail.com
درر الشاطي,الشقيق,جازان,الشقيق,شارع الامير محمد بن ناصر,7714,,017-0000000,asa14141@Hotmail.com
فندق ديار السلام الفضي,المدينة المنورة,المدينة المنورة,حي النقاء,سعد بن ابي وقاص,2165,20664,+966148192111,diyaralmadinacompany@gmail.com
فندق ساري مرمرة الفندقية,العاصمة المقدسة,مكة المكرمة,الروابي,الصلواتي,2700,86217,+966504107859,alhathloulprojects@gmail.com
شقق نوازل القمة,الولامين,الرياض,مخطط ال مصري,امن الطرق,520,,011-2632186,abo.sagar2000@hotmail.com
شركة النهدي للشقق المفروشه,الطائف,مكة المكرمة,حي الاخباب,الخط الدائري,7502,7502,+966505716757,al.aseel.2007@hotmail.com
شقق مطل أبها للشقق المفروشة,أبها,عسير,حي شمسان,طريق الرياض,4252,2,+966557744443,skab966@gmail.com
نزل الأحلام,السيل الكبير,مكة المكرمة,السيل الصغير,طريق السيل,9769,,012-2069479,ss2005ww@gmail.com
واحة مسكننا,خميس مشيط,عسير,النسيم,سعد بن ابي وقاص,5060,,017-2388560,m0505725368@gmail.com
شركة ابراج معاد لتشغيل الفنادق,العاصمة المقدسة,مكة المكرمة,النزهه,الرضوه,7423,26513,+966125532000,sendmesa@hotmail.com
شقق النايفة الذهبية للوحدات السكنية,الرياض,الرياض,حي ظهرة لبن,ثقيف,2951,13242,+966114320399,haaa_222@hotmail.com
فندق الشاكرين جولدن توليب الفندقية,المدينة المنورة,المدينة المنورة,حي بني خدرة,ابو ايوب الانصاري,2665,691,+966148160700,albasha1001@hotmail.com
فندق دار سادن,العاصمة المقدسة,مكة المكرمة,ريع بخش,اجياد,2601,,014-5356170,Homoidan11@gmail.com
شقق آزر حياة للوحدات السكنية المفروشة,الرياض,الرياض,حي العليا,عبدالملك بن مروان,2763,12611,+966112192232,A.ALZAMIL@OUTLOOK.COM
ديار الباحه,بالجرشي,الباحة,مقمور,الملك عبدالعزيز,99,,017-7226504,ibinageil@hotmail.com
ورد روما,الرس,القصيم,الخالدية,الشنانه,2541,,016-3334584,bn-rashed@hotmail.com
شقق لمسات ذهبيه للوحدات السكنية,محايل,عسير,البلد,الملك عبدالله,3430,3430,+966172851662,aaaf112345@gmail.com
مؤسسة العنوان للوحدات السكنية,الدمام,الشرقية,النخيل,28,8388,8388,+966138331667,fahd836@hotmail.com
شقق قصر وناسه للوحدات السكنية,الهفوف,الشرقية,حي الروضة,فيصل بن فهد بن عبدالعزيز,8505,9002,+966555986222,ebooralmasafat@gmail.com
فندق مريديان جدة,جدة,مكة المكرمة,الروضة,طريق المدينة النازل,7176,,012-6633333,mashal.alnafea@lemeridien.com
فندق فهد عبدالله العميري,العاصمة المقدسة,مكة المكرمة,المسفلة,الهجرة,0,,014-5756666,alhateemsaf@gamil.com
شركة المجد الذهبية شركة شخص واحد,جدة,مكة المكرمة,الصفا,الأمير متعب,59,3524,+966126938888,msmy.2040@gmail.com
ستيبريدج الخبر للشقق المخدومة,الخبر,الشرقية,العليا,-,6633,4616,+966138696666,salaal.alotaibi@ihg.com
ابهى القصور,جدة,مكة المكرمة,الحمرا,فلسطين,25,,012-6971463,majhh@hotmail.com
فندق حديقة الروز الفندقية,العاصمة المقدسة,مكة المكرمة,المسفلة,ابراهيم الخليل,7921,5458,+966125203000,hr@surratiperfumes.com
زهرة المنار اثنين,جازان,جازان,المطار,المطار,1,,017-3215999,binhendi_est@hotmail.com
فندق نجوم المدينة الفندقية,المدينة المنورة,المدينة المنورة,حي النقا,المنطقة المركزية  الغربية جوار الحرم,0,1425,+966538378641,moliky93@gmail.com
فندق صفوة الركوبة,صامطة,جازان,الركوبة,صامطة الركوبة,4190,109,+966545202001,yahya.m@live.co.uk
دار منار المدينة,المدينة المنورة,المدينة المنورة,المستراح,الامير عبد المجيد,196,,014-8275111,z0503300007@windowslive.com
شقق السهم الذهبي للشقق المخدومة,الطائف,مكة المكرمة,القيم,المطار,7252,4046,+966127600003,ELSAWAT.S1@GMAIL.COM
مركز ابهى القصور,نجران,نجران,حي ال منجم,الملك عبدالعزيز,231,,017-5220530,ALMAQBOOL61@HOTMAIL.COM
فندق جلنار طيبة,المدينة المنورة,المدينة المنورة,حي بني خدرة,ابو ايوب الانصاري,3211,20733,+966148292115,ALI.Q.J.5@HOTMAIL.COM
ليالي الحياة للوحدات السكنيه المفروشه,الدرب,جازان,الكدرة,العام,1,00000,+966173466977,algaber531@hotmail.com
لؤلؤة بكه الفندقية,العاصمة المقدسة,مكة المكرمة,الستين,شارع الستين,0,,014-5778599,alsalah.hotel@hotmail.com
شقق برج الشارقة للشقق المفروشة,نجران,نجران,حي شرق المطار أ,الحصن سابقا,9008,9008,+966501502282,sdad11131@gmail.com
دره وادي الدواسر,الولامين,الرياض,الولامين,العام,613,,011-7840004,moh7846505@gmail.com
شقق إنجازان للوحدات السكنية المفروشة,الخبر,الشرقية,الشراع,الدارقطني,3360,,013-8020677,musfer@enjazalsharq.com
حدائق الفافا,بريدة,القصيم,الرابية,الدائري الداخلي الضلع الشرقي,0,,016-3840666,majed7577@hotmail.com
فندق هوازن الأصيل الجديد الفندقية,العاصمة المقدسة,مكة المكرمة,الجامعة,عبد الله خياط,3647,7454,+966125503002,alaseelcompanyhotel@gmail.com
شركة لو بارك كونكورد لتشغيل الفنادق,سكاكا,الجوف,النزهة,طريق الامير عبدالاله بن عبدالعزيز,8213,72441,+966548285555,info@leparkconcord.com
برج الجنوب,خميس مشيط,عسير,الراقي,الراقي,19,,017-2232222,mans.a98700@gmail.com
أبعاد جدة,جدة,مكة المكرمة,حي السلامة,شارع قريش,3035,,012-6624995,abaadlg@hotmail.com
شقق حديقة الروابي إين للشقق المخدومة,جدة,مكة المكرمة,الروابي,بن لادن,8764,112129,+966126650861,ALMUTHEL@HOTMAIL.COM
شقق جنة العريف للوحدات السكنيه,الرياض,الرياض,حي الشهداء,شارع ابي جعفر المنصور,3684,13241,+966011450900,eurocovi2018@outlook.sa
فندق كروان الفهد الفندقية,الرياض,الرياض,العليا,طريق العروبة,501,8552,+966112172345,gm@carawan-alfahad.com
شقق سمت للشقق المخدومة,الرياض,الرياض,النرجس,السلامة,2890,13329,+966112335226,muhammad-2273@hotmail.com
فندق جوهرة الفيروز,المدينة المنورة,المدينة المنورة,بضاعة,ابوعبيده بن الجراح,162,,014-8206000,shattajorob@hotmail.com
فندق سرايا طابه أ فرع شركة منارة طابه لإدارة وتشغيل الفنادق المحدودة,المدينة المنورة,المدينة المنورة,بني خدرة,جعفر بن ابي طالب,6159,25011,+966500123124,hr-moaqeb@almadinah-harmony.com
افاق رتاج للوحدات السكنية,الرياض,الرياض,السليمانية,عبد العزيز بن مساعد,7689,,011-4495500,hr.m@obear.com
النبأ للوحدات السكنية المفروشة,جزيرة جنة,الشرقية,الفناتير,طريق الوجه سدير,9021,,013-3475000,nabaarabia@hotmail.com
شركة اجياد للخدمات الفندقية,العاصمة المقدسة,مكة المكرمة,أجياد,شارع شعبة قريش,0,24431,+966125230004,info@unitedothaim.com
فندق الزائر خليل الفندقية,العاصمة المقدسة,مكة المكرمة,المسفلة,ابراهيم الخليل,8094,13144,+966551794340,0551794340yy@gmail.com
شركة ابراج المحمديه للتنميه العقاريه المحدوده فندق المدينه موفنبيك,المدينة المنورة,المدينة المنورة,حي بني خدرة,سعد بن ابي خدرة,2979,1582,+966569922558,hr.madinah@accor.com
مؤسسة طيبة جدة للوحدات السكنية,جدة,مكة المكرمة,حي طيبة,عمير بن الحمام(رضي الله عنه),6799,31024,+9666366948,aljehani.abdulrahman.s@gmail.com
فندق الشهداء,العاصمة المقدسة,مكة المكرمة,حي اجياد,اجياد,6415,2588,+966125744401,albassam@shohadahotel.com
شركة سهل الشاطئ لتشغيل الفنادق,الدمام,الشرقية,الشاطئ الشرقي,سايمان الانصاري,6922,32413,+966138096000,mahmoud.dawood@talainnhotel.com
قمة الوعد 1,العاصمة المقدسة,مكة المكرمة,بير بليلة,العام,9,,014-5732666,talal.center2006@gmail.com
خالد عمر ابوبكر العمودي,العاصمة المقدسة,مكة المكرمة,الرصيفة,الهنداوية,0,,014-6717257,bdb1bdb@hotmail.com
فندق رمادا للشقق الفندقية,نجران,نجران,العريسه,شارع السايب بن الوليد,9272,297,+966175441145,a_h321@yahoo.com
العييري للوحدات السكنية المفروشة,جدة,مكة المكرمة,بني مالك,فلسطين,8684,,012-6755583,adelalshami@hotmail.com
شقق مندرين الشرق للوحدات السكنية,الزلفي,الرياض,حي الصديق,طريق الملك عبدالله جنوب,8574,2871,+966164225777,arrab.ama@hotmail.com
ماسة ريتاج,المدينة المنورة,المدينة المنورة,قربان,عمر بن عبدالعزيز,0,,014-8285569,ritalhotel@gmail.com
الالماسية المميزة,جدة,مكة المكرمة,الزهراء,حراء,0,,012-6924888,RANI.ABUSAUD@ARAMCO.COM
قصر الحمراء للوحدات السكنية المفروشة 6,جدة,مكة المكرمة,الشرفية,طريق الملك عبدالله,245,,012-6500138,d-s-a52@hotmail.com
قصر نمارق للوححدات السكنية المفروشة,الخفجي,الشرقية,حي الملك فهد,شارع مكه,3087,,013-7660886,sabahiosman@gmail.com
شقق انوار التعاون للشقق المفروشة,المدينة المنورة,المدينة المنورة,العوالي,علي بن ابي طالب,8419,8419,+966148251884,yaeseryaserf@gmail.com
وحدات سكنيه محمد بندر عسكر عقال لسلوم,نجران,نجران,مخطط حبونا,الحزام,0,,017-2222223,bandar.a@najran.gov.sa
شقق دار قصر النور للوحدات السكنية,خميس مشيط,عسير,ذلالة,شارع عام,8825,3214,+966542923050,abotarky1391@gmail.com
شهباء روز الفندقية,العاصمة المقدسة,مكة المكرمة,ابو طبنجة,المسفلة,2356,,014-7925639,eng.fsaleem@gmail.com
فندق الألفية الفندقية,الرياض,الرياض,العليا,الوادي الاوسط,8996,8996,+966112161152,Faisal@millenniahotel.com
شقق الخيول البرونزيه للوحدات السكنية,صبيا,جازان,حي الرحاب,طريق الملك عبدالعزيز,6644,734,+966173260480,amagg1372@gmail.com
مؤسسة محمد عبدالله محمد السويلم الفندقية,عرعر,الحدود الشمالية,خارج حدود الاحياء,طريق الملك فهد,1,95,+966146620462,saudswail@hotmail.com
برج الجنوب,خميس مشيط,عسير,الموسى,الستين,14,,017-2266663,ANS.A98700@GMAIL.COM
مؤسسة أرجوان لبنان للوحدات السكنية المفروشة,جدة,مكة المكرمة,السلامة,سعيد بن حمدان,4047,8589,+966541041043,aaabbbsh1001@hotmail.com
حلام ساهرة,جدة,مكة المكرمة,الربوة,بشار بن عدي,12,,012-6682535,tareek1001@hotmail.com
مسارات المملكة اربعة,العاصمة المقدسة,مكة المكرمة,الهجلة,طريق إبراهيم الخليل,0,,014-5778882,n.t7@hotmail.com
سما الشرق,الهفوف,الشرقية,الخالدية,الأمير نايف بن عبدالعزيز,0,,013-5887479,mr_mkd@hotmail.com
موشحات الأندلس,جدة,مكة المكرمة,طيبه,طيبه,0,,012-6072686,mwf67@hotmail.com
شركة اوبين الفندقية,الرياض,الرياض,حي قرطبة,شارع عبدالله بن ابراهيم بن سيف,3833,245099,+966112223171,openqassim@gmail.com
شركة الميار للوحدات السكنيه المفروشه,الرياض,الرياض,المنصورة,شارع الأمير سعود بن عبدالرحمن,4054,6690,+966114462502,yahey193@gmail.com
فندق زهرة السعد خمسة الفندقية,العاصمة المقدسة,مكة المكرمة,الششة,الملك فهد,24236,891,+966125660061,nasserdyab@hotmail.com
فندق حنين الحياة,العاصمة المقدسة,مكة المكرمة,المسفله,العام,3883,3868,+966125759999,ymna54@hotmail.com
مؤسسة مجرة الثرياء للوحدات السكنية المفروشة,نجران,نجران,حي شرق المطار أ مخطط أ,طريق الملك عبدالعزيز,8950,000,+966532088885,j_2200@hotmail.com
حياة حقل,حقل,تبوك,حي الحميضة,شارع الحميضة,104,,014-4531888,info@hayathaql.com
فندق سلامة روتانا,جدة,مكة المكرمة,حي السلامة,طريق المدينة المنورة فرعي,7178,127202,+966122303333,yasir.alradhwi@rotana.com
فندق الإباء الفندقية,العاصمة المقدسة,مكة المكرمة,جرول,الحفاير,9059,2635,+9660000000,memo22233322233@hotmail.com.com
يوسفية الخير للشقق الفندقيه,نجران,نجران,العريسه الشمالي,الملك عبدالعزيز,3,,017-5444369,mbrkhadi@yahoo.com
شقق دانة المروج للشقق المخدومة,أبها,عسير,المروج,بحران,2175,8033,+966017245454,azzambt@bintaleb.com
بيت الانفال,الرياض,الرياض,السويدي,الدائري الغربي,12455,,011-4319990,a0551552552@gmail.com
افق الصحاري,الرياض,الرياض,الخليج,ابن الهيثم,0,,011-2311403,saqer.almutere2016@gmail.com
مؤسسة الورود الماسية للشقق المفروشة,نجران,نجران,حي العريسة,طريق الملك عبدالعزيز,4203,8991,+966175442050,alwrwdaalmasya@gmail.com
شقق أجنحه أمار للوحدات السكنية,الرياض,الرياض,الملقا,محمد بن عبدالعزيز الدغيثر,11,13521,+966114851600,amarsuites2@outlook.sa
العقارية للشقق المفروشة,أبها,عسير,السد,الملك عبد العزيز,4512,,017-2276753,a1013277502@gmail.com
العلياء للوحدات السكنية,الفرعة,الباحة,البراقة,الملك عبدالعزيز,0,,017-7360055,Saaedalz1980@hotmail.com
شقق نفال للوحدات السكنيه,بيشة,عسير,حي الملك عبدالله,العام,6998,3170,+966176202222,nafalbisha1@gmail.com
فندق جوار المدينة الفندقية,المدينة المنورة,المدينة المنورة,حي بني خدرة,الهيثم بن ابي سنان,2736,2221,+966148460013,al-edresey@hotmail.com
فندق قصر السلام الفندقية,أبها,عسير,السد,شارع البويضاء,7844,7844,+966559710555,ABDALAZIZ10555@HOTMAIL.COM
فندق ايلاف مشاعر,العاصمة المقدسة,مكة المكرمة,حي اجياد,حمزة بن عبدالمطلب,6699,13541,+966012664133,aalghamdi@elafgroup.com
فندق مكارم زبيدة الفندقية,العاصمة المقدسة,مكة المكرمة,جرول,عمر بن عبدالعزيز,36521,8108,+966125460421,Waml55@hotmail.com
شقق سما الطائف للشقق المخدومة,الطائف,مكة المكرمة,حي شهار,شهار,2248,26513,+966127328201,khaled.alshahrani@gmail.com
درجة الفخامة للوحدات السكنية المفروشة,الرياض,الرياض,الروابي,شارع عنيزة,6,,011-1254642,sma.almnar@hotmail.com
رست نايت للوحدات السكنية المفروشة,وادي الدواسر,الرياض,النويعمه,العام,1,18617,+966112785904,INFO@RESTNIGHT.COM.SA
شقق درر الأندلس للوحدات السكنية المفروشة,الرياض,الرياض,حي العليا,الامير عبدالعزيز بن مساعد بن جلوي,6786,6786,+966114611410,kh-8@hotmail.com
شموع,القويعية,الرياض,الربوة,طريق الملك سلمان,4244,,011-6556002,fh8504@gmail.com
فرع شركة الأحلام الهادئة,جدة,مكة المكرمة,ابحر الجنوبية,عمرو بن مره,6486,,012-6567029,r.abdullah@quietdreams.com.sa
شقق بانوراما للوحدات السكنية,الدمام,الشرقية,احد,الملك سعود,2315,0255,+966138221234,r2222q@hotmail.com
شقق الحسام عرعر للوحدات السكنيه,عرعر,الحدود الشمالية,حي المباركية,الخمسين,152,,014-6611888,acnazir@yahoo.com
شقق محمد السبيتاني للشقق الفندقية,العاصمة المقدسة,مكة المكرمة,حي الراشدية,الفردوس,2817,24269,+966125563322,abdulmajeed-1406@hotmail.com
شقق ترف ينبع اثنان للوحدات السكنية المفروشة,ينبع,المدينة المنورة,البحيرة,طريق الامير مقرن,8778,8778,+966143913355,TARAFYANBU2@GMAIL.COM
فندق ديار الهدى الفندقية,المدينة المنورة,المدينة المنورة,حي النقاء,حفصه بنت عمر,2163,20664,+966148189000,diyaralmadinacompany@gmail.com
فندق عبير الضيافة الفندقية,العاصمة المقدسة,مكة المكرمة,حي التيسير,شارع الحفاير,7604,5941,+966125488882,motawi_d@hotmail.com
فندق المدينة الذهبي الفندقية,المدينة المنورة,المدينة المنورة,حي بني خدرة,ابو ايوب الانصارى,2791,3604,+966148460000,nabeel@digas.com.sa
دار الملوك,جازان,جازان,حي السويس,شارع الستين,20,,017-3213393,faheedalharthi@yahoo.com
فندق ميار الروضة الفندقية,جدة,مكة المكرمة,الروضة,طريق المسجد  الحرام,0,102775,+966555315030,mhaiek82@windowslive.com
فندق كي,الباحة,الباحة,الباحه,طريق الملك فهد,1,,017-7222238,AKZ-ALKHATAM@HOTMAIL.COM
فندق تاج مداريم فرع شركه مداريم,الرياض,الرياض,حي الفلاح,المطار,7698,103308,+966112758888,SECRETARY@MADAREEMCROWN.COM
روشان الخليح للوحدات السكنية,الدمام,الشرقية,الشاطئ,الكورنيش,5155,,013-8318000,salah_dammam@hotmail.com
حياة الهدا,الهدا,مكة المكرمة,الغشامرة,الطريق الدائري,0,,012-7545112,bar.6.hs@gmail.com
فخامة الطائف,الطائف,مكة المكرمة,شبرا,ابو بكر,0,,012-7320202,efdfer@live.com
مساكن الزمرد,ينبع,المدينة المنورة,الصريف,طريق عمر بن عبدالعزيز,7257,,014-3905557,adilsssr@gmail.com
اوبين الفندقية,العاصمة المقدسة,مكة المكرمة,النزهة,جدة مكة القديم,2585,24221,+966595906606,openhotelmeeca@gmail.com
قصر نافا,الرياض,الرياض,غرناطة,محمد علي جناح,3225,,011-2111478,maged.heweezi@hotmail.com
سقاية الاصيل الفندقية,العاصمة المقدسة,مكة المكرمة,أجياد,ريع بخش,0,,014-5503002,omarjaad@hotmail.com
انس الجوار,احد رفيده,عسير,لزمة,لزمة,361,,017-2611100,hmmoos.214365@hotmail.com
بودل,محايل,عسير,القدس,طريق الملك عبدالله,3584,75,+966920000666,exe.dir@boudl.com
مؤسسة درر رابغ للوحدات السكنية,رابغ,مكة المكرمة,مخطط المرجانية,شارع عام,3008,254,+966114109442,dm333a@hotmail.com
لؤلؤة اشبيليا للوحدات السكنية المفروشة,الرياض,الرياض,اشبيليا,القبة,6477,,011-2311105,panado0ol_666@hotmail.com
نوارة شمس,العاصمة المقدسة,مكة المكرمة,المسفلة,ابراهيم الخليل,0,,014-5971706,famus_111@hotmail.com
شركة الدرة الرائدة للاستثمار,جدة,مكة المكرمة,حي الزهراء,صاري فرعي,3520,44228,+966122333555,AA500SS@HOTMAIL.COM
شقق سحب أبها للشقق المفروشة,خميس مشيط,عسير,النسيم,طريق الامير سلطان,1,62465,+966172352323,sohobabha@gmail.com
شقق لينا البحر للشقق المفروشة,ينبع,المدينة المنورة,الفلاح,عمر بن الخطاب,1106,7998,+966143572111,Abdulrahmanali07@hotmail.com
شقق حديقة الزهور للوحدات السكنية,ينبع,المدينة المنورة,حي قرطبة,الملك عبدالعزيز,3970,46429,+966143222203,mn2245@hotmail.com
لؤلؤ الشرق,المدينة المنورة,المدينة المنورة,العريض,الملك عبدالعزيز الطالع,64,,014-0000000,al.naef1@hotmail.com
فندق رواد الشمال الفندقية,العويقلية,الحدود الشمالية,الخليج,الدولي,3736,424,+966146691275,badar986574@gmail.com
شقق برج الورد للوحدات السكنية المفروشة,الطائف,مكة المكرمة,العرفاء الغربيه,العام,9543,0000,+966127292701,bebo58517@yahoo.com
صيف الطائف,الطائف,مكة المكرمة,القطبية,طريق الملك خالد,1,,012-7325588,turkigroup@hotmail.com
شقق ترف ينبع للشقق المخدومة,ينبع,المدينة المنورة,حي الربيع,طريق الملك عبدالعزيز,3506,3506,+966143915771,TARAFYANBU@GMAIL.COM
جوهرة الكندرة,جدة,مكة المكرمة,الصحفة,الستين,12,,012-0126351,TAREEK1001@HOTMAIL.COM
شقق الماسه الخليجيه للوحدات السكنية,الدمام,الشرقية,حي احد,"حي احد شارع الملك سعود, حي احد",2517,8835,+966138187881,gulfdiamondapartment@gmail.com
فندق اللورد,القيصومة,الشرقية,الفيصلية,الملك فهد,3400,,013-7245225,mktaba3890@hotmail.com
فندق رحاب المروة اثنين,العاصمة المقدسة,مكة المكرمة,شعب عامر,المسجد الحرام,33004,8805,+9669665722033,Rihaabalmoltakaah@gmail.com
شقق الاوفاز للوحدات السكنية,بيشة,عسير,حي الفهد,King Saud,6498,3548,+966176201808,turki1904@hotmail.com
شقق غرناطة بالاس إن للشقق المخدومة,الرياض,الرياض,الشهداء,شارع عبدالرحمن بن عزاز,7344,7344,+966550009856,dareena2030@gmail.com
ليالي الروشه,تبوك,تبوك,الفيصلية,الأمير فهد بن سلطان,6812,,014-4248117,khaled_m_2011@hotmail.com
صفاء الروح,الطائف,مكة المكرمة,السلام,الحلقة الشرقية,0,,012-7320202,nahasddedj@live.com
شقق نزل السائح للشقق الفندقية,الدمام,الشرقية,حي الشاطئ الشرقي,ياقوت,3365,3365,+966138444416,admin@tripperinn.com
فندق الشمال,حفر الباطن,الشرقية,المحمدية,الملك عبدالعزيز,8447,,013-7219994,a.11ab@hotmail.com
