الاسم,المدينة,المنطقة,الحي,الشارع,صندوق البريد,الرمز الريدي,الجوال,البريد الالكتروني
شقق اسيل صبيا للوحدات السكنية,صبيا,جازان,حي الملك فهد,الامير سلطان,3601,85299,+966173262743,tairyabdullah@gmail.com
درة حطين ـ بريرا,الرياض,الرياض,حطين,سعود بن محمد بن مقرن,6733,,011-2364247,ahmad.al-shammari@riyadcapital.com
شقق فرحه العالمية للوحدات السكنية,جدة,مكة المكرمة,حي الحمدانية,جبل حسان,6231,336,+966126551160,ali@farhaintl.com
فندق دار الوافدين,العاصمة المقدسة,مكة المكرمة,المسفلة,ابراهيم الخليل,2373,,014-5369553,alwafedeen@hotmail.com
فندق ماجد,العاصمة المقدسة,مكة المكرمة,المسفلة,الكنكارية,0,,014-5248145,shadi_x6@hotmail.com
شقق أجنحه أمار للوحدات السكنية,الرياض,الرياض,الربيع,طريق ابي بكر الصديق,7090,4505,+966114552006,amarsuites2@outlook.sa
الرمال الراقية,جدة,مكة المكرمة,الرويس,حائل,7058,,012-6520062,abooghala@gmail.com
شركة اجنحة الفصول الاربعه الفندقية (شركة شخص واحد),جدة,مكة المكرمة,المحمديه,طريق المدينه,2977,173,+966504403666,aljawakh@hotmail.com
شركة نقاط ثلاثة الرضا الفندقية,المدينة المنورة,المدينة المنورة,بني خدرة,ابي سعيد الخدري,4068,2417,+966112423424,hatem979.gm@hotmail.com
شركة برج الجوهرة الفندقية شركة شخص واحد,العاصمة المقدسة,مكة المكرمة,حي العزيزية - محبس الجن,شارع الرحمة,4302,2694,+966125503420,aadd93@hotmail.com
شقق ظلال الياسمين للشقق المفروشة,خميس مشيط,عسير,الوفاء,الملك عبدالله,1,8361,+966172205859,zelal.alyasmine887@gmail.com
فندق الدار البيضاء فرع شركة الدار البيضاء للخدمات الفندقيةوالسياحيةالمحدودة,العاصمة المقدسة,مكة المكرمة,حي النسيم,مخرج-طريق عثمان بن عفان رضى الله عنه-الدائري الثالث,6316,6316,+966126827771,a.khoja@casablanca-ksa.com
شقق بيوت الضيافة للشقق المخدومة,الطائف,مكة المكرمة,سلطانة,المطار,7442,2470,+966553728484,abu_salah600@hotmail.com
شقق جوين للوحدات السكنية المفروشة,جدة,مكة المكرمة,حي الحمراء,فلسطين,3828,3828,+966126650558,jowainresd@hotmail.com
سحب الصيف,وادي زيد,عسير,طريقة العقيقة,طريق العقيقة,1,,017-2860070,hashbal2015@gmail.com
قرطبة,الرياض,الرياض,الشفا,الترمذي,140,,011-4231192,alowin@live.com
زهرة الشعب,العاصمة المقدسة,مكة المكرمة,شعب عامر,شارع الغزه,214124,,014-5741801,shadi_x9@hotmail.com
شقق رحالة للوحدات السكنية,جدة,مكة المكرمة,الزهراء,شارع عبدالله  الجاسر,2866,7418,+966505307777,dos_911@yahoo.com
شركة نزل الروضة المحدودة,المدينة المنورة,المدينة المنورة,المناخة,سعيد بن زيد القرشي,6564,42311,+966550979057,kh_444@hotmail.com
بيستانا,الرياض,الرياض,العقيق,السليمانية,2145,,011-2429207,PESTANAHOTEL03@HOTMAIL.COM
مقر مكين,حائل,حائل,الوسيطاء,الملك فهد,5445,,016-5651000,eathar2008@gmail.com
الجو العليل,خميس مشيط,عسير,هيف,الحملات,0,,017-2215744,wwwer_88@hotmail.com
المنزل الوثير,جدة,مكة المكرمة,الاجاويد,الاجاويد العام,0,,012-6207180,zahratagaweed@hotmail.com
فندق بدر المرسى,المدينة المنورة,المدينة المنورة,المناخه,سعيد بن زيد,42311,,014-8352777,scorpionbox1111@yahoo.com
شقق سحاب عنيزة للوحدات السكنية المفروشة,عنيزة,القصيم,شرق الاشرفية,Abdullah AlNaem,7445,6266,+966163653222,saleh_gmc@hotmal.com
جمعية البر الخيرية,الحرجة,عسير,الغربي,الشارع العام,1,,017-2490295,A2490403@HOTMAIL.COM
جوهره قرية للوحدات السكنية المفروشة,قرية العليا,الشرقية,الاندلس,الامير محمد بن فهد,137,,013-3866661,sanonyoffice@yahoo.com
شقق بيت الايواء للوحدات السكنية,الدمام,الشرقية,حي المنار,الامام محمد بن سعود,2511,66535,+966138130259,Bander.112233@hotmail.com
برج الفخامة للايواء السياحي,الرياض,الرياض,غرناطه,علي المروزي,1784,,011-2228333,bader5606@hotmail.com
فندق اللؤلؤة الزرقاء الفندقية,العاصمة المقدسة,مكة المكرمة,حى جرهم,شارغ المنصور,8708,3743,+966012534507,adel0594213678@hotmail.com
المساكن الفاخرة,الشفا,مكة المكرمة,الفرع,الطريق الدائري,17,,012-7502202,almansori000@yahoo.com
شقق مساس الخليج للوحدات السكنية,الدمام,الشرقية,الروضه,الامير نايف بن عبدالعزيز,66,32252,+966138678889,turkey5550@hotmail.com
فندق غزالان الفندقية,الرياض,الرياض,النرجس,أنس بن مالك,3316,3316,+966114216585,showwalah@hotmail.com
شقق رويال الخبر للشقق المفروشة,الخبر,الشرقية,الثقبة,طريق الملك خالد,6889,730,+966138985513,alshagroud@yahoo.com
مؤسسة النباريس الذهبيه للوحدات السكنيه المفروشة,جدة,مكة المكرمة,الروابى,عج بن عاج,8989,460,+966126591584,abeedmosfer@gmail.com
فندق رويال الروضة,المدينة المنورة,المدينة المنورة,بضاعة,ابي غبيده الجراح,2779,42311,+966148205555,salman@mohysen.com
شقق عائشة حسن أحمد الشهري للشقق المفروشة,بيشة,عسير,الخزامي,العام,0,,017-6202088,a1091030146@gmail.com
فندق مركيور الخميس,خميس مشيط,عسير,حي الضباط,شارع الملك فيصل,8186,,017-2233466,hr.mercurekm1@gmail.com
شركة بيت الكنز للشقق الفندقية شركة شخص واحد,جدة,مكة المكرمة,حي الزهراء,الامير سلطان,7402,11763,+966126420000,saljehani@ameralaboud.net
شقق اركان شموخ للوحدات السكنية المفروشة,أبو عريش,جازان,الزهور,الملك فهد6035,6035,000,+966173252555,saleh050121@gmail.com
مؤسسة القصر السكري للوحدات السكنيه,بريدة,القصيم,التعليم,الملك عبدالعزيز,6235,248,+966163265060,khkh25@hotmail.com
شهد العز,القويعية,الرياض,البساتين,الملك عبدالعزيز,19,,011-6520205,baddah253@gmail.com
فندق قصر العزيزية,العاصمة المقدسة,مكة المكرمة,العزيزية الجنوب,طريق الامير سلطان,50,,014-5510111,fa.abid22@gmai.com
شقق فضة تالا للشقق المخدومة,بريدة,القصيم,الافق,الورود,3233,1000,+966163841855,appegy1@gmail.com
شقق ليالي الشرق للوحدات السكنية المفروشة,المبرز,الشرقية,حي الفيصل,القدس,2515,1275,+966135364333,albander@albanderco.com
فندق رشد المجد الفندقية,العاصمة المقدسة,مكة المكرمة,المسفلة,دحلة الرشد,3767,19958,+9665700007,ibrahim.daghustani@almajd-alarabiah.com
فندق شرفة الخليج,جسر الملك فهد,الشرقية,الخبر الشمالية,شارع الامير تركي بن عبد العزيز,14,,013-8810000,INFO@GULFTERRACEHOTEL.COM.SA
فندق سويت نوفتيل,الجابرية,المدينة المنورة,العنود,الملك عبدالله,313,,014-3980000,t.alfaqieh@alhokair.com
بيت لمار للوحدات السكنية المفروشة,الرياض,الرياض,العليا,الامير عبدالعزيز بن مساعد بن جلوي,6966,12221,+966114624222,bytlamar@hotmail.com
فندق بلاتينيوم أربعة,المدينة المنورة,المدينة المنورة,حي مسجد الدرع,طريق عثمان بن عفان طريق العيون,8073,,014-8658888,alawajireit@hotmail.com
مؤسسة قصر عسير للشقق الفندقية,خميس مشيط,عسير,العزيزية,الملك عبدالله,7905,1190,+966172237518,hassan1.moth@gmail.com
فندق طيبة روز الفندقية,المدينة المنورة,المدينة المنورة,النقاء,أم المؤمنين زينب بنت جحش رضي الله عنها,3104,2455,+966148444130,moliky93@gmail.com
الماسة الذهبية,الرياض,الرياض,النهضة,ابن الهيثم,501,,011-4111473,alwaheri2012@gmail.com
دار الجوار,المدينة المنورة,المدينة المنورة,قربان,طريق قربان النازل,11210,,014-8287710,murshid375@hotmail.com
فندق بيت الحجيج لصاحبه محمد عبدالغني الصباغ,العاصمة المقدسة,مكة المكرمة,المسفلة,ابراهيم الخليل,1,1251,+966568852410,0551794340yy@gmail.com
نزل حديقة الوسام للنزل السياحيه,الطائف,مكة المكرمة,حي الاخباب,شارع عمر بن الخطاب رضي الله عنه,7428,7428,+966127373111,wissam.garden2@gmail.com
مؤسسة نزل الشرقي للوحدات السكنية المفروشة,حائل,حائل,نقرة قفار,الامير سعود بن عبد المحسن,3750,,016-5662020,ahmadalblwyi123@gmail.com
ركن نوفا,جدة,مكة المكرمة,البغدادية,حائل,8,,012-6110096,nova.fashion@hotmail.com
فندق زهر الحطيم الفندقية,العاصمة المقدسة,مكة المكرمة,حي الشبيكة,الشبيكة,3863,3863,+966125721666,zahratalhateem@hotmail.com
فندق روابي الحجاز الفندقية,العاصمة المقدسة,مكة المكرمة,النزهة,شارع عام,7416,2724,+966125448301,rawabi-alhijaz@hotmail.com
فندق القمر,الدمام,الشرقية,المزروعية,الأمير محمد بن فهد,0,,013-8326688,asdajam@hotmail.com
جوهرة فراس اثنين,العاصمة المقدسة,مكة المكرمة,المنصور,شارع المنصور,123456,,014-5316185,athm3an@gmail.com
شقق دانة المصيف للشقق المخدومة,الطائف,مكة المكرمة,المنتزة,الملك خالد,3460,3460,+966127441969,usus100@hotmail.com
شقق سر الاقامة للشقق المفروشة,الرياض,الرياض,الحمراء,ال داود,3855,3855,+966112403218,ser.aleqama25@gmail.com
شمس و رمال,الدرب,جازان,الكدرة,العام,1,,017-2595053,abojaber9@hotmail.com
شركة اوبروي السعودية المحدودة,المدينة المنورة,المدينة المنورة,حي بضاعة,ابي ذر الغفاري,6930,6930,+966148282222,eyad.hafiz@oberoihotels.com
شركة رواح للشقق المخدومة,الطائف,مكة المكرمة,حي مثمله,طريق مكه,8628,110,+966127290097,kutalalamal1436@gmail.com
شقق نزل ايفاء للوحدات السكنية,محايل,عسير,الخالدية,العام,4898,0000,+966555751900,Amh1800@hotmail.com
شركة ادارة لإدارة وتشغيل الفنادق,المدينة المنورة,المدينة المنورة,حي بضاعة,سعد بن معاذ,6935,41340,+9668181000,Ali.Alzahrany@movenpick.com
شقق مجمع الديره للشقق المفروشة,جدة,مكة المكرمة,حي السلامة,صاري,3594,10593,+966126823020,hameed9992009@hotmail.com
شركة فندق العثمان المحدودة,الظهران,الشرقية,حي القشلة,34464,8276,402,+966138533000,aelhariri@a-othman.com
شقق البتيل للشقق المخدومة,الرياض,الرياض,حي المغرزات,القنادي,7833,12483,+966112464264,MALBAHIJI@GMAIL.COM
شقق رمز ابها للشقق المخدومة,أبها,عسير,السامر,ابراهيم الحديثي,9259,4940,+966172261777,turkiabbas2010@hotmail.com
العنوان للوحدات السكنية,الدمام,الشرقية,النخيل,الثمن والعشرين,8388,,013-8331667,fahd836@hotmail.com
مأوى الراحة,الشقة العليا,القصيم,الشقه,الدائري الغربي,1,,016-3259995,khaled01sh@gmail.com
فندق السابق واحد,العاصمة المقدسة,مكة المكرمة,العزيزية,طريق الطائف,11,,014-5562012,saleemaz137@gmail.com
فندق نجمة أجياد الفندقية,العاصمة المقدسة,مكة المكرمة,اجياد,اجياد,3,24234,+966125302121,ksa43312214@gmail.com
محبة الأخوين,العاصمة المقدسة,مكة المكرمة,القشله,التيسير,212,,014-5350000,m-a201110@hotmail.com
قصر اليمامة,الرياض,الرياض,العريجاء,خديجة بنت خويلد,373,,011-4911166,seco811@gmail.com
شركة بيسان الذهبي الفندقية,العاصمة المقدسة,مكة المكرمة,اجياد,عام,1,23435,+966540016600,ep.makkah@gmail.com
شقق قصر صبابة للشقق المفروشة,حائل,حائل,صبابة,الملك فيصل بن عبدالعزيز,3539,1235,+966165356080,a.alhamzani@gmail.com
شقق الليلك للوحدات السكنية المفروشة,الدمام,الشرقية,الروضة,الملك فهد بن عبدالعزيز,2747,2747,+966505811582,aziz6672580@gmail.com
فندق رند,الرياض,الرياض,السليمانية,المهندس مساعد العنقرى,3250,13041,+966112885000,salman.alomran@wandalushotels.com
فندق مجاهد سعيد الشريف,العاصمة المقدسة,مكة المكرمة,الروضة,شارع الامير ماجد,3984,3984,+966500105414,deyar.elrawda@gmail.com
شقق الفخامة راحاتي للوحدات السكنية,العارضة,جازان,الرخة,العام,1,171,+966506460331,aa999.sn@gmail.com
فندق السحب الملتهب,المدينة المنورة,المدينة المنورة,الدفاع,الامير  نايف,3766,,014-8415077,dss.7.85@hotmail.com
كرم الحجاز اثنان,المدينة المنورة,المدينة المنورة,المصانع,شارع ابوبكر الخلال,0,,014-8196966,karam_alhejaz@hotmail.com
شقق نجمة الروشن للشقق المخدومة,عنيزة,القصيم,شرق الإشرافية,234,0,345,+966545503333,fg55011@gmail.com
شقق قصر الردف للشقق الفندقية,الطائف,مكة المكرمة,السداد,طريق الشفا,1,11000,+966127425326,hasen39@gmail.com
أجنحة تالة,بريدة,القصيم,الريان,المتفرع من عمر بن الخطاب,0,,016-3820041,sak2015bur@gmail.com
شقق روعة المساء للشقق المفروشة,الرياض,الرياض,اليرموك,"Abi Gaafar Almansour, ابي جعفر المنصور",431,102617,+966112304115,humoud1375@gmail.com
شقق قصر جنى للوحدات السكنية المفروشة,جدة,مكة المكرمة,حي مدائن الفهد,الشريف محمد بن عبد الله,2239,11816,+966505679370,janapalace@hotmail.com
شقق درر سمو للشقق المفروشة,دومة الجندل,الجوف,حي سيل الدلهمية,الطريق الدولي,2507,170,+966555390945,a1022739419@gmail.com
شقق ابراهيم محمد عبدالله فلقي,محايل,عسير,الضرس,طريق محايل ابها العام,46,,017-2851281,info@imfalqy.com
منازل جدة,جدة,مكة المكرمة,السلامة,شارع عبد الرحمن السديري,0,,012-6404040,salehtawi@yahoo.com
المصباح المميز للوحدات السكنية الفندقية,أبا السعود,نجران,الاثايبة,الجوافه,209,,017-6524447,gh4_gh4@hotmail.com
نزل الصفوة,أبها,عسير,الخشع,جبل عليا,999,,017-2284366,alalal-8@hotmail.com
فندق دارة المزار الذهبي الفندقية,العاصمة المقدسة,مكة المكرمة,حي التيسير,المنصور,3061,10887,+966555505875,aa5rko@gmail.com
شقق ركن نابل للشقق الفندقية,الرياض,الرياض,السنبلة,شارع الملك عبدالعزيز,0,124429,+96606344449,ss198518@yahoo.com
فندق طيبة أربعة,المدينة المنورة,المدينة المنورة,المغيسلة,الزاهدية خلف الاماره الجديدخ,4240575,,014-8155515,hopaelomda@gmail.com
فندق روضة الشريعة الفندقية,العاصمة المقدسة,مكة المكرمة,حي المعابدة,شارع,3976,5732,+966125333300,AHMAD@ASHARIAH.COM
فندق سقاية البيت الفندقية,العاصمة المقدسة,مكة المكرمة,المسفله,ابراهيم الخليل,3913,0,+966125300353,saleem_alharbi@hotmail.com
قصر المعالي للوحدات السكنية,بريدة,القصيم,الامن,الملك سعود,0,,016-3832136,reshodicomp@gmail.com
شقق الآء بيشه للوحدات السكنية,بيشة,عسير,الموسى,العام,4125,267,+966176230880,q1048856221@gmail.com
الطائف احلى,الطائف,مكة المكرمة,523,الفيصلية,15,,012-7320916,nahasdeer@live.com
شقق هبي نيس للوحدات السكنية,المدينة المنورة,المدينة المنورة,حي العريض,طريق الملك عبدالله,8188,0000,+966148341422,happinees.hotel@gmail.com
شقق أجنحة ازدهار للوحدات السكنية,رفحاء,الحدود الشمالية,النموذجية,الشيخ محمد العثيمين,6113,13,+966505415078,Yasser1909@hotmail.com
دار ميعاد,الباحة,الباحة,الشفا,الامير فيصل بن محمد بن سعود,0,,017-7241731,a-a.4@msn.com
شركة هادية عبداللطيف جميل لتجارة المواد الغذائية,جدة,مكة المكرمة,حي الاندلس,حائل,8749,2368,+966126010300,Hussain.alsulaimani@movenpick.com
مؤسسة رمادان تربه للوحدات السكنية المفروشة,تربة,مكة المكرمة,السلام,الطائف,6,3999,+966128221111,saad00004@hotmail.com
ازهى القصور,الرياض,الرياض,النهضة,عبيدة بن الحارث,6824,,011-2335222,oz5432@yahoo.com
شركة مبارك الراية لتشغيل الفنادق,العاصمة المقدسة,مكة المكرمة,أجياد,بير بليلة,4522,7750,+966503511663,f.arishi@hotmail.com
شقق نور مينا الشرق للشقق المخدومة,الدمام,الشرقية,حي الشاطئ الشرقي,5د,8370,8370,+966138190800,ga505ga@gmail.com
آسيا,ضباء,تبوك,البير,طريق الملك عبدالله,52,,014-4321888,I.m.alfarraj2@gmail.com
فندق مواكب اجياد,العاصمة المقدسة,مكة المكرمة,ريع بخش,اجياد,42662,,014-5356020,memo-am99@hotmail.com
فندق القرية الساحلية للبحر الأحمر شركة شخص واحد,أملج,تبوك,-,طريق الوجه,0,48321,+966550072700,ali.alzemami@theredsea.sa
فندق أركان المنار الفندقية,المدينة المنورة,المدينة المنورة,بضاعة,سعد بن معاذ,7026,2480,+966590006590,h.t.est@hotmail.com
عابر الفندقية,عنيزة,القصيم,الاشرفية,الامير سلطان,3528,75,+966920000666,exe.dir@boudl.com
فندق قصر الاندلس الفندقية,المدينة المنورة,المدينة المنورة,حي بضاعة,سعد بن معاذ,152,7115,+966553454999,al-andalus-al-raqi@hotmail.com
شقق اجنحة النعماني للشقق المخدومة,جدة,مكة المكرمة,حي الحمراء,المعادى,3795,18258,+966550066688,Bens3d@hotmail.com
فندق دارالشريعه الفندقية,العاصمة المقدسة,مكة المكرمة,حي الشبيكة,ابراهيم الخليل,3863,5732,+966125330000,a.sharah@hotmail.com
إيلاف قباء,المدينة المنورة,المدينة المنورة,المغيسله,قباء,5,,014-8261978,abdullah.kurde@yahoo.com
نزل فهد محمد عبدالعزيز القاسم للنزل السياحيه,الرياض,الرياض,حي العمارية,بدون اسم,4598,9414,+966114505152,Joundob@outlook.sa
فندق ميرة الوضة اثنين الفندقية,العاصمة المقدسة,مكة المكرمة,حي الروضة,المسجد الحرام,4223,8341,+966125584405,mhm.mira@hotmail.com
فندق جوهرة الشريعة الفندقية,العاصمة المقدسة,مكة المكرمة,حي التقوى,اسماء بنت النعمان بن الحارث,7756,5732,+966125333330,AHMAD@ASHARIAH.COM
فندق نافيتي من وارويك للفنادق,الخبر,الشرقية,الخبر الجنوبية,شارع الامير تركي بن عبدالعزيز,850,2779,+966138971799,ceo.asst@almhuaidibresidence.com
شقق اوركيد طريف للوحدات السكنية المفروشة,الدرعية,الرياض,المعيزلة,محمد بن غريب,2997,13231,+966503031229,orchidaturaif20@gmail.com
شقق اوركيدا  عرعر,بريدة,القصيم,الرحاب,عمر بن الخطاب,1066,,016-3977745,or6640129@gmail.com
فندق وسام الحوراء,أملج,تبوك,الدقم,الملك فيصل بن عبدالعزيز,87,,014-4383226,laawr1991@gmail.com
مؤسسة سعيدهادي مهدي للايواء السياحي,يدمة,نجران,يدمه,الملك خالد,4298,,017-5451112,abu-kh2009@hotmail.com
فندق الرياض رمادا,الرياض,الرياض,حي الوزارات,الامير منصور بن عبدالعزيز,200,45407,+966114121000,gmadmin@ramadariyadh.com
قصر آجا للوحدات السكنية المفروشة,الخبر,الشرقية,حي الثقبة,طريق الملك خالد,6917,6917,0138949933,sultan2000mas@gmail.com
رابية الحجازي خمسة الفندقية,العاصمة المقدسة,مكة المكرمة,الششة,عبد الله الفيصل,45,,014-5652078,aseelalqemah2030@gmail.com
ضيافات الحرمين اثنين,العاصمة المقدسة,مكة المكرمة,العزيزية,عبدالله الخياط,1,,014-5290159,m@diyafat.com
البندريه للوحدات السكنية المفروشة,الدمام,الشرقية,السلام,الحادي عشر,2888,9212,+966138338844,ahmed.aljaber@al-nassergroup.com
فندق الارض المتميزة,العاصمة المقدسة,مكة المكرمة,حي المسفلة,الهجرة,8699,5732,+966555734030,info@plco.com.sa
شقق تاله للوحدات السكنية المفروشة,الرياض,الرياض,حي السليمانية,ابي بكر الرازي,3043,88671,+966114760866,rino-305@hotmail.com
شقق الياقوتة الدولية للوحدات السكنية المفروشة,جدة,مكة المكرمة,البوادي,شارع قريش,2628,43410,+966555605604,ksa5555ksa@hotmail.com
فندق جوهرة العدل الفندقية,العاصمة المقدسة,مكة المكرمة,حي العدل,طريق الملك فيصل بن عبد العزيز,9099,1017,+966125661152,khalil787@hotmail.com
فندق نزل العليا,الرياض,الرياض,العليا,عبدالملك بن مروان,2,,011-4655656,salehak2004@gmail.com
شقق كروان القصيم للشقق الفندقية,بريدة,القصيم,الرفيعة,عمر بن عبدالعزيز,6302,27027,+966163480404,crownalqassim@gmail.com
شقق رافال الشرق للوحدات السكنية,الرياض,الرياض,اليرموك,ابي جعفر المنصور,3563,427,+966114548460,matebnlo@gmail.com
شقق جواهر الملقا للوحدات السكنية,الرياض,الرياض,الملقا,العمرة,2852,,011-2709891,qaed22222@hotmail.com
السكن الدافئ,جازان,جازان,المطار,الامير فيصل بن فهد,7383,,017-3174545,Alskn.d1001@gmail.com
شقق روضات الرياض للوحدات السكنية المفروشة,الرياض,الرياض,حي اليرموك,المليسان,4344,1523,+966112226221,alielhalag0@gmail.com
فندق قصر الرشيد الفندقية,العاصمة المقدسة,مكة المكرمة,حي الشبيكة,ابراهيم الخليل,3888,3888,+9660000000,Ghassmans@hotmail.com
أجنحه درة للوحدات السكنيه المفروشه,الرياض,الرياض,المونسية,البلقاء,7343,11474,+966114852036,naseeralyami@hotmail.com
وحدات سكنية مفروشة,حائل,حائل,المنتزه الشمالي,المنتزه الشمالي,3221,,016-5669333,naseemaldabab2000@outlook.sa
فندق دار الايمان انتركونتننتال الفندقية,المدينة المنورة,المدينة المنورة,حي بضاعة,"ابراهيم الخليل, ابراهيم الخليل - المسفلة",2657,2728,+966125295091,IBRAHIM.NAKHAL@IHG.COM
شقق سماءالقنفذه للوحدات السكنية المفروشة,القنفذة,مكة المكرمة,الخالدية,الستين  طريق الملك فهد,7269,125,+966560740902,samaa.elqonfidah@gmail.com
