الاسم,المدينة,المنطقة,الحي,الشارع,صندوق البريد,الرمز الريدي,الجوال,البريد الالكتروني
روزصامطه,صامطة,جازان,صامطه,السوق الداخلي,34,,017-3322639,RoseSamtah@hotmail.com
الحزم للوحدات السكنية المفروشة,الرياض,الرياض,العليا,الحر بن قيس,42,,011-2175701,hazmco@hotmail.com
فندق الجزيره فرع شركة مجموعه مرعي بن محفوظ وشركاه مساهمة مقفلة,العاصمة المقدسة,مكة المكرمة,الحجون,شارع المسجد الحرام,8888,1139,+966125730202,jazeerah@mbmgroup.org
فندق الراية المتميز الفندقية,جازان,جازان,النسيم,طريق الملك عبدالعزيز,6380,5415,+966173203001,dir.manager@salbassami.com.sa
فندق سنود العظمة الفندقية,العاصمة المقدسة,مكة المكرمة,بطحاء قريش,العام,7414,5394,+9661255588855,lad@snoodhotels.com
مواسم اغادير,أبها,عسير,وسط البلد,العام,1,,017-2298344,M.FGEER@HOTMAIL.COM
شقق برج الربيع للشقق المفروشة,الجبيل,الشرقية,الدانه,شارع المدينة المنورة,4524,940,+966133611952,meshal.alshamrani@gmail.com
شقق قمة البرج الذهبي للشقق المفروشة,القريات,الجوف,الحميدية,عمر بن الخطاب,6199,216,+9666411119,HMDAAN1439@GMAIL.COM
تالة الصحافة,جدة,مكة المكرمة,المشرفه,الصحافه,349,,012-6421694,Muense3@gmail.com
شقق غادين للوحدات السكنية,احد رفيده,عسير,حي الخليج,الواديين,3098,1035,+966172750000,gadeen2013@gmail.com
شركة هوستا الفندقية,الرياض,الرياض,الياسمين,الامير ناصر بن فرحان ال سعود,2874,7284,+966553231314,altayyar@darhashim.com
فندق الميرة الهجرة للخدمات الفندقية,العاصمة المقدسة,مكة المكرمة,حي المسفلة,الهجرة,8373,24233,+966125351323,admingov@awangrp.com
فندق لؤلؤة الشرق,العاصمة المقدسة,مكة المكرمة,حي اجياد,طريق المسجد الحرام,6702,1418,+966125420312,yahya21@alfouadgc.com
مؤسسة عبدالله يحي محمد طيري الفندقية,صبيا,جازان,النهضة,شارع الأمیر ماجد بن عبدالعزيز,2755,778,+966173280770,abdullahtiri@gmail.com
الدانة الخليجية للوحدات السكنية المفروشة,جسر الملك فهد,الشرقية,العليا,الفضل بن اسماعيل,0,,013-8985820,aldana.alkhaleejah@gmail.com
فندق فرج المدينة الفندقية,المدينة المنورة,المدينة المنورة,حي مسجد الدرع,طريق عثمان بن عفان,8445,0,+966148699911,farajhotel@gmail.com
شركة حور بارك الفندقية (شركة شخص واحد),جدة,مكة المكرمة,حي الحمراء,جزر القمر,6833,6833,+966122755505,gm@hoorpark.com
فندق الوافدين الفندقية,العاصمة المقدسة,مكة المكرمة,حي جرهم الجنوبية,طريق ابراهيم الخليل,8820,3306,+966555511739,alwafideen@gmail.com
شقق منازل البلد للوحدات السكنية المفروشة,خميس مشيط,عسير,السلام,بلال,0,1534,+966172221221,azaz42464246@gmil.com
تالين,الرياض,الرياض,النخيل,طريق الأمام سعود بن عبد العزيز بن محمد,155,,011-2664000,sa-taleen@hotmail.com
قصرمنازل الدوحه,نجران,نجران,الضيافه,شيبه بن عثمان,52,,017-5424242,ZAII2011@YAHOO.COM
شقق لؤلؤة جازان للوحدات السكنية,جازان,جازان,حي الشاطئ,شارع 2  هـــ,6810,82812,+96660173310555,fuadd111@gmail.com
فندق لؤلؤة الأصيل,العاصمة المقدسة,مكة المكرمة,العزيزية,محبس الجن,0,,014-5580926,omarjaad@hotmail.com
اضواء رمادا اثنين,صامطة,جازان,الجراديه,الشارع العام,23658,,017-0000000,alsallum_001@outlook.com
شقق المدار بارك للشقق المخدومة,الرياض,الرياض,حي اشبيلية,القبة,7438,128,+966112783030,elsalam3030@gmail.com
فندق جوهرة المنشية,العاصمة المقدسة,مكة المكرمة,حي الهجلة,المسيال,6221,24231,+966505643302,Habeebm2001@yahoo.com
همس ابها,أبها,عسير,المنسك,ابو بكر,1,,017-2310444,zx2230233@gmail.com
شقق نيلوفر الرائد للشقق المخدومة,جدة,مكة المكرمة,حي الفضيلة,الشارع العام,2055,87804,+966505468669,kareem_moh@hotmail.com
سحاب لبن للوحدات السكنيه المفروشه,الرياض,الرياض,حي لبن,شارع الناصرية,6842,1049,+966112352221,fn105378@gmail.com
منازل فرحان للوحدات السكنيه,جازان,جازان,الشاطئ,طريق الملك فهد,538,,017-3216600,max_morsy@yahoo.com
فندق نجمة الرشد,العاصمة المقدسة,مكة المكرمة,المسفله,ابراهيم الخليل,0,,014-5352900,ghassanagr4@gmail.com
فندق امجاد الجزيرة,العاصمة المقدسة,مكة المكرمة,اجياد,المصافى,2,,012-5774500,amjadhotels@hotmail.com
اماليا للوحدات السكنية المفروشة,خميس مشيط,عسير,النسيم,الامير سلطان,1,,017-2227000,zx2230233@gmail.com
امار,الرياض,الرياض,السويدي الغربي,الدائري الغربي,1,,011-2472715,aboomar1965@gmail.com
شقق نسمات للوحدات السكنية المفروشة,بريدة,القصيم,حي الريان,Almunsiyah,8265,8265,+966163260707,mutlaq.saleh@outlook.com
فندق داما,ضباء,تبوك,طريق ضباء تبوك,طريق ضباء تبوك,6264,,014-4321938,saudb1400@hotmail.com
مؤسسةاطلالةالربيع للوحدات السكنيه المفروشة,الطائف,مكة المكرمة,حي السرور,king khaled,8675,8675,+966127442652,ETLALT.ALRBYE@HOTMAIL.COM
فندق العلمين,جدة,مكة المكرمة,البلد,الملك عبد العزيز,3097,6418,+966126483953,fallza00@gmail.com
شقق رافال الجنوب للشقق المخدومة,جازان,جازان,حي المطار,العام,2934,2934,+966501042322,m_almuaddi@hotmail.com
شقق شاطيء الحياة للشقق المخدومة,جدة,مكة المكرمة,حي المروة,المنيني,4817,8608,+966122880291,shatyalhayat@gmail.com
منازل المسافر ثلاثة,العاصمة المقدسة,مكة المكرمة,دخلة الولايا,المسفلة,0,,014-5396344,hani13911@gmail.com
فرع شركة مجموعة العييري التجارية المحدودة,القنفذة,مكة المكرمة,الخالدية,الثلاثين,102,,012-7331119,amrosalem26@yahoo.com
اطلالة الواحة,المجمعة,الرياض,الطريق الدائري,طريق الملك عبدالله,100,,011-6322229,kana9us@yahoo.com
مواسم جدة,ثول,مكة المكرمة,الفلاح,الفلاح,5646,,012-6443070,alfaisal-08@hotmail.com
حبيب الحافي للشقق المفروشة,شقراء,الرياض,الغدير,طريق الملك عبدالعزيز,3080,,011-6227070,a7mad2266@gmail.com
شقق لوفا للوحدات السكنية,ينبع,المدينة المنورة,الدانة,شارع عمر بن الخطاب,8402,4940,+966143919642,ateeqalrefai@gmail.com
نزل ليزوان ( أنتولا ),الرياض,الرياض,حي الرمال,شارع الضوء,16,,011-2664000,sa-taleen@hotmail.com
اجنحة تولان,الرياض,الرياض,الروضة,حفصه بنت عمر,1662,,011-4941024,ahmednassar5@gmail.com
شقق بيت الماس للوحدات السكنية,أبها,عسير,النسيم,رماح,6653,6653,+966172268898,maas_house_apartment@outlook.com
شقق فرحه العالمية للوحدات السكنية,جدة,مكة المكرمة,حي الحمدانية,جبل حسان,6231,336,+966126551160,ali@farhaintl.com
فندق مكارم أم القرى,العاصمة المقدسة,مكة المكرمة,الروابى,اجياد,8003,7020,+966125356100,hrm.umq@makarem.sa
زهره اشبليا,الرياض,الرياض,اشبيليه,شارع الخزنه,97,,011-2404037,adelzarzora@gmail.com
دار الهدى المعابده,العاصمة المقدسة,مكة المكرمة,المعابدة,الأمير ماجد بن عبد العزيز,9311,,014-5586446,dar-alhuda@hotmail.com
اوبال الفندقية,أبا السعود,نجران,العريسة,الملك عبد العزيز,1245,,017-5440022,ALFOHID@HOTMAIL.COM
قصر الحنان,ينبع,المدينة المنورة,النسيم,الملك عبد العزيز,7410,,014-3917979,ammar1389lolo@gmail.com
شقق شعاع السودة للشقق المفروشة,أبها,عسير,"7877,حي القرى",5414،حي القرى,20,11466,+966172217598,alahmariahmd28@gmail.com
نزهة المشتاق الفندقية,العاصمة المقدسة,مكة المكرمة,حي النزهة,شارع حسين عرب بجوار ادارة الدوريات الامنية,0,,014-5423026,faqeih1@yahoo.com
منازلنا للوحدات السكنية المفروشة,الرياض,الرياض,حي القدس,الامير محمد بن سعود,3268,12078,+966112459400,f5151@hotmail.com
فندق ماسة الوادي الفندقية,العاصمة المقدسة,مكة المكرمة,النزهه,الرضوى,19,24221,+966125469797,alwadihotel@yahoo.com
ابيات ليان,أبها,عسير,الخشع,عمر بن عبد العزيز,7193,,017-2242555,ssm.606@hotmail.com
درر داريا للوحدات السكنية المفروشة,الرياض,الرياض,الملقا,وادي نوار,36,,011-4853100,abo.sagar2000@hotmail.com
أصال حائل,قفار,حائل,النقرة,فهد العريفي,3,,016-5356558,assalhail@gmail.com
جمعية فتاة ثقيف الخيرية النسائية بالطائف,جدة,مكة المكرمة,المروة,حراء,3161,4931,+966501575197,f.thaqeef@gmail.com
هوليدي ان بوابة جدة,جدة,مكة المكرمة,المروة,طريق المدينة الطالع,1,,012-6836666,ragheb.hr@redseapalace.com
فندق ارتال العالمي للخدمات الفندقية,المدينة المنورة,المدينة المنورة,بضاعة,طريق الملك فيصل ( الدائري الاول ),2997,42311,+966542439389,af@alsubaihisons.com
صفا الذهبي,المدينة المنورة,المدينة المنورة,بني خدرة,الهيثم بن ابي سنان,0,,014-8365999,Safa_grop@hotmail.com
شقق نجمه نواره للوحدات السكنية,نجران,نجران,الضيافه,العام,0,,017-0000000,a1025425347@gmali.com
مؤسسة انهال للوحدات السكنية,الدمام,الشرقية,حي الزهور,الفخر الرازي,5435,6724,+966138098444,mzkhaldi@hotmail.com
يسر للوحدات السكنية المفروشه,القيصومة,الشرقية,المصيف,شارع الملك فيصل بن عبد العزيز,22142,,013-7227363,danahtibahgroup@hotmail.com
فندق سفير العرب,رفحاء,الحدود الشمالية,المساعدية,الامير عبدالله بن  عبدالعزيز بن مساعد,8,,014-6760089,tlal80@hotmail.com
فندق منارة الضيافة,العاصمة المقدسة,مكة المكرمة,آجياد السد,الملك عبدالعزيز,1,,014-5771177,aliayash@hotmail.com
الجمعية التعاونية برفحاء,رفحاء,الحدود الشمالية,المساعدية,الدولي,151,,014-6760742,C.s.rafha@gmail.com
مركذ الصفا,المدينة المنورة,المدينة المنورة,المصانع,المطار الناذل,0,,014-8365999,safagroup@hotmail.com
شقق حديقة الزهور للوحدات السكنية,ينبع,المدينة المنورة,الامارة,عمر بن الخطاب,3943,46422,+966143210101,mn2245@hotmail.com
شركة راية الخالدية للشقق المخدومة,جدة,مكة المكرمة,الخالدية,الامير سعود الفيصل,2652,7490,+966569585085,hb881-hr1@swissotel.com
فندق سنابل الازهر الفندقية,العاصمة المقدسة,مكة المكرمة,حي الهجلة,العام,6175,24221,+966503593960,alnahet@hotmail.com
مؤسسة زهرة النسيم المتميزة للواحدات السكنية المفروشة,جدة,مكة المكرمة,النسيم,أبي العباس الحديثي,10,2916,+966126406718,malekaam1410@gmail.com
شقق راحة البلاد,صبيا,جازان,السلامه,شارع الملك فيصل,0,,017-3263000,qmaa_1@hotmail.com
أجنحة سارة,دومة الجندل,الجوف,الظهرة,الامير سلطان,0,,014-6221129,s.s.as.1428@gmail.com
مناحي ناصر فيحان السهلي,الفراج,الرياض,مخطط 46,العام,127,,011-5522111,alsahliii123@gmail.com
فندق عروق الذهب المكية,العاصمة المقدسة,مكة المكرمة,حي العزيزية,شارع الإحسان,8844,8844,+966562410241,a-aayan@hotmail.com
فندق الهجرة الماسي الفندقية,العاصمة المقدسة,مكة المكرمة,اجياد,الهجرة,9191,6310,+966531499980,fa_339@hotmail.com
فندق جدة هيلتون,جدة,مكة المكرمة,الشاطئ,الكورنيش,1,,012-6590000,mohammed.alshareef@hilton.com
مؤسسة شذا أبها للشقق المفروشة,أبها,عسير,الصفا,البخاري,7912,12345,+966172279589,yiy2000sa@gmail.com
فندق جوهرة التوحيد الفندقية,العاصمة المقدسة,مكة المكرمة,المسفله,التقوى,3346,24233,+966125460118,Yahya21@alfouadgc.com
فندق مكارم اجياد مكة,العاصمة المقدسة,مكة المكرمة,حي اجياد,حمزة بن عبدالمطلب,6699,6020,+966125720500,Hrm.Ajyad@Makarem.sa
فندق ايمن احمد سندي,العاصمة المقدسة,مكة المكرمة,حي الطندباوي,شارع جرهم,3210,364,+966145363700,walismail@yahho.com
فندق اعمار اليت المدينة الفندقية,المدينة المنورة,المدينة المنورة,بضاعة,شارع ام سلمة,6905,5064,+966541482033,k.alkomey@emaaraldiyafa.sa
شركة واجهة نجران للوحدات السكنية,نجران,نجران,حي شرق المطار a,شارع الحصن,3241,66441,+966011111111,wajiht.najran@gmail.com
لؤلؤة التوبة,العاصمة المقدسة,مكة المكرمة,المسفلة,العام,0,,014-5382120,amone56@hotmail.com
فندق جوهرة يزن,العاصمة المقدسة,مكة المكرمة,المسفلة,إبراهيم الخليل,3676,,014-5344010,abdur8887@hotmail.com
شقق بلبيس للوحدات السكنية,بريدة,القصيم,الريان,عمر بن سليم,1,1234,+966504285291,belbes9397@gmail.com
مؤسسة اجنحة الحريري للوحدات السكنية,جدة,مكة المكرمة,حي الحمدانية,عامر بن المنذر(رضي الله عنه),2811,8508,+966555900076,ALHARIRI.HOTEL@GMAIL.COM
شركة الشاطئ الخامس للفنادق التجارية,الرياض,الرياض,المروج,العليا,9092,103617,+966112975758,Faisal.BinSomeh@rotana.com
الماسة الذهبية الأولى,المدينة المنورة,المدينة المنورة,الدرع,سيد الشهداء,88,,014-8340927,goldendaimond1@gmail.com
المختارة العالمي,المدينة المنورة,المدينة المنورة,بضاعة,الستين,42311,,014-8291311,tarig444@hotmail.com
راما الخليجية للوحدات السكنية,الرس,القصيم,هندية,امير المؤمنين علي ابن ابي طالب,12,,016-3380707,r.m.m.14@hotmail.com
لؤلؤة تبارك للوحدات السكنية المفروشة,القياس,جازان,الكدرة,الشارع العام,1,,017-3466889,a9a9d9000@hotmail.com
الرمال منازلى,جدة,مكة المكرمة,الحمراء,شارع غزة,34,,012-6656955,ayman@manazeli.com
صفوة سارة للشقق المفروشه,الدمام,الشرقية,طيبه,ابويحي السلمي,97,,013-8352001,alameenfirst@gmail.com
سما عرعر للشقق المفروشة,عرعر,الحدود الشمالية,المساعدية,الملك عبدالعزيز,389,,014-6640129,or6640129@gmail.com
سنترو العليا من روتانا,الرياض,الرياض,العليا,وادي الارطاوي,7590,55905,+966560696995,a.aljaafari@rotana.com
فندق نور منازل الكرام,العاصمة المقدسة,مكة المكرمة,العزيزية,النور,8732,,014-5594999,dmakers111@gmail.com
دار مشرف,المخواة,الباحة,المثلث,الملك فهد,9354,,017-7391078,aaasssdddaa121212@gmail.com
برود الطائف,الطائف,مكة المكرمة,حي شبرا,شارع شبرا,7467,,012-7329000,broad@outlook.sa
فندق دار التقوى,المدينة المنورة,المدينة المنورة,حي بضاعة,ممر مشاه داخل المنطقة المركزية,2981,6894,+966148291111,fahad.shehata@taqwamadinah
شقق أسيل العلاء للوحدات السكنية,العلا,المدينة المنورة,مخطط المنح 1,العام,7163,716,+966592400092,aloole9292@hotmail.com
الجعفرية,العاصمة المقدسة,مكة المكرمة,المسفلة,المسيال,4029,,014-5377222,emas_2013@yahoo.com
مؤسسة غالية أحد للوحدات السكنية,المدينة المنورة,المدينة المنورة,حي مسجد الدرع,عبدالرحمن بن غنيم بن سعد الاشعري,3083,42313,+966148355833,ghaleyt-ohood@hotmail.com
فندق رتاج الساحل,ينبع,المدينة المنورة,الخريق,طريق الملك عبد الله,4439,,014-3224228,naji_transport_ynb@hotmail.com
ميلاف للوحدات السكنيه المفروشه,الرياض,الرياض,المغرزات,الدوادمي,6558,12481,+966112693822,melafsuites@hotmail.com
بودل,المجمعة,الرياض,حي القدس,الملك عبدالعزيز,588,75,+966509868643,Mgr.afairs@boudl.com
فندق اليمامه الفندقية,النعيرية,الشرقية,العزيزية,عمرو بن كلثوم,8268,37451,+966133730772,F33yamama@yahoo.com
ميثاق التيسير الحديث,العاصمة المقدسة,مكة المكرمة,جرول,التيسير,2,,014-5437013,p.makkah@yahoo.com
شقق منازل الشرقيه للوحدات السكنيه,الجبيل,الشرقية,العليا,الشارع الثاني,422,34446,+966318941005,yousefamri1@hotmail.com
نسايم ليل المصيف,الشفا,مكة المكرمة,الضيق,وادي الضيق,0,,012-0127508,omar.alamliki.07@gmail.com
القبة الذهبية,الرياض,الرياض,الشميسي,شارع الامام عبد العزيز بن محمد بن سعود,107,,011-4094111,kapah98@gmail.com
دانة رماح,رماح,الرياض,مخطط 26,العام,0,,011-5522250,a-_-news@hotmail.com
فندق مآثر الطيبة الفندقية,المدينة المنورة,المدينة المنورة,حي المناخة,طريق الملك فيصل - الدائري الاول,6619,42321,+966501912366,mather@gmail.com
شقق كاذي جدة للوحدات السكنية المفروشة,جدة,مكة المكرمة,مدائن الفهد,الاستاذ الارياضي,0,22336,+966126899111,kadi.jeddah.2016@gmail.com
دار الامان,العاصمة المقدسة,مكة المكرمة,جرول,شارع عمر ابن عبدالعزيز,0,,014-5420333,sa.d.r@hotmail.com
فندق ميرا,جدة,مكة المكرمة,الرويس,شارع الكورنيش,1,,012-6141040,govr@mirahotel.org
فندق الوسام الذهبي الفندقية,الحناكية,المدينة المنورة,المخطط العام حي الشفا,طريق الملك عبد العزيز,1,8611,+966148620349,alrays1@hotmail.com
فندق منار التوحيد1,العاصمة المقدسة,مكة المكرمة,حي المعابدة,طريق الملك فيصل رحمه الله,3657,12418,+966125700005,MANAR_ALTAWHEED@YAHOO.COM
فندق أجياد الجوار الفندقية,العاصمة المقدسة,مكة المكرمة,أجياد,طريق الملك عبدالعزيز,4711,0,+966125541046,albassam.abdul@gmail.com
دار راما,الرياض,الرياض,النسيم الغربي,أكثم بن صيفى,3865,,011-2260202,darrama2020@gmail.com
فرع شركة مجموعة العييري3للوحدات السكنية المفروش,جازان,جازان,المطار,الأمير فيصل,2,,017-3310555,turkyshahrani@gmail.com
شقق ارض الشاطى للوحدات السكنية,الرياض,الرياض,حي النرجس,شارع رقم 229,7928,4148,+966114552773,Landbeach.hotel@outlook.sa
فندق ندوة قريش,العاصمة المقدسة,مكة المكرمة,البيبان,جرول,2473,24231,+966125752538,quraish_group1986@yahoo.com
فندق فخامة الامجاد الفندقية,العاصمة المقدسة,مكة المكرمة,شعب عامر,شارع غزا,26,,014-5270022,y_h@windowslive.com
نور الصلاح,العاصمة المقدسة,مكة المكرمة,جبل الكعبة,جبل الكعبة,1,,014-5450022,A0555508571@HOTMAIL.COM
شركة ستون فلج للفلل الفندقية,الخبر,الشرقية,تالا,العزيزية,0,,013-8909998,algofali@hotmail.com
شركة عبدالله و يوسف عبدالله الاسيمر,الدمام,الشرقية,الخالديه,0,0,3922,+966137228181,terket999@gmail.com
فندق برج الضيافة الفندقية,العاصمة المقدسة,مكة المكرمة,حي المسفلة,الهجرة,8795,5941,+966125488882,motawi_d@hotmail.com
فندق نسمات اجياد الفندقية,العاصمة المقدسة,مكة المكرمة,اجياد,بئر بليلة,6320,8243,+966506520002,a.m.j_350@hotmail.com
الرحاب,العاصمة المقدسة,مكة المكرمة,المسفلة,ابراهيم الخليل,0,,014-5384314,info@almarwa-ltd.com
أنوار الحبيب,المدينة المنورة,المدينة المنورة,قربان,العوالي الطالع,3475,,014-8488812,hr@florina.sa
شقق المثمر للوحدات السكنية,جدة,مكة المكرمة,الحمراء,الاسكندرية,2631,23212,+966122631222,fahad.h@mothmir.net
بيت الانفال,الرياض,الرياض,السويدي,الدائري الغربي,234,,011-4326215,baitalanfaal@yahoo.com
فندق كارلتون المعيبد,الدمام,الشرقية,حي الراكة الشمالية,القاسم الخوارزمي,2767,1235,+966565548929,personnel@carlton-hotel.com.sa
شقق سارة للشقق المفروشة,جسر الملك فهد,الشرقية,العقربية,اليرموك,14,,013-8982726,ATC-1403@HOTMAIL.COM
فندق سماء ام القري,العاصمة المقدسة,مكة المكرمة,الحفاير,ام القري,2,,014-6922888,tbta3@naddarabia.com
الميساء الذهبية,خميس مشيط,عسير,العزيزية,الملك عبدالله,132,,017-2217601,zir.vip@hotmail.com
فندق أرتال طيبة الفندقية,المدينة المنورة,المدينة المنورة,حي قربان,ابو قتاده الانصارى,8123,1930,+966540000869,malsubaihi@alsubaihisons.com
جوهرة البدائع,العاصمة المقدسة,مكة المكرمة,العزيزيةالجنوبي,الاميرسلطان,57,,014-5247847,bador05999@gmaildot.com
راحة المجد,الرياض,الرياض,المونسية,الفجر,165,,011-4452880,mohsen.112@hotmail.com
فندق أوان,العاصمة المقدسة,مكة المكرمة,الروابى,أجياد,8199,24234,+966553636556,admingov@awangrp.com
فندق العليان الذهبي الفندقية,العاصمة المقدسة,مكة المكرمة,المسفلة,شارع ابراهيم الخليل,3608,7657,+966125395130,ha.alyzedei@gmail.com
شقق دار حنين للشقق المفروشة,الرياض,الرياض,حي طويق,سليمان بن عبدالملك بن مروان,2522,23061,+966533337575,m0504445031@gmail.com
شركة نخبة الملقا الفندقية شركة شخص واحد,الرياض,الرياض,حي الصحافة,وادي بيش,7359,2361,+966501883956,info@almalqaelitehotel.com
فندق شذي الوسام اثنان الفندقية,العاصمة المقدسة,مكة المكرمة,حي اجياد,شارع العام,5281,1254,+966555536199,bussmathail@hotmail.com
واحة ألين,الهفوف,الشرقية,القريشية,الخليج,0,,013-5888818,alreem-1@hotmail.com
شقق نزل الاسرة للشقق المفروشة,ليلى,الرياض,حي الملك فهد,الأمير محمد بن عبدالعزيز,3435,504,+966116822229,nasser171383@gmail.com
نزل البحر للوحدات السكنية المفروشة,الخبر,الشرقية,الشبيلي,الرقعي,7274,,013-8633331,just-me-0000@hotmail.com
شقق الغروب للشقق المخدومة,الرياض,الرياض,حي بدر,الخليفة المامون,8479,2601,+9664235899,KIG-800@hotmail.com
دانا للوحدات السكنية المفروشة,الفرعة,الباحة,بني سار,شارع الملك عبد العزيز,1,,017-7317444,DANA1434DANA@GMAIL.COM
فندق نخبة جدة,جدة,مكة المكرمة,الشاطئ,الامير فيصل بن فهد,6,,012-6205771,essamzahuan@gmail.com
